{
  "$schema": "https://raw.githubusercontent.com/kovrichard/portable-agent-layer/main/assets/schema/pal-settings.schema.json",
  "identity": {
    "ai": {
      "name": "",
      "fullName": "",
      "displayName": "",
      "catchphrase": ""
    },
    "principal": {
      "name": "",
      "timezone": ""
    }
  },
  "loadAtStartup": {
    "files": []
  },
  "dynamicContext": {
    "wisdom": true,
    "opinions": true,
    "relationship": true,
    "failurePatterns": true,
    "projects": true,
    "handoff": true,
    "selfModel": true,
    "contextualSteering": true,
    "skillMatching": true,
    "wallClock": true,
    "repoState": true,
    "workTree": false,
    "workTreeGate": false,
    "workTreeDecisionGate": false,
    "dueReminders": false,
    "interactionAwareness": true,
    "reactionSampling": true,
    "claimCheck": true,
    "claimCheckBlocks": false,
    "adaptationRules": true,
    "entityCards": true,
    "entityExtraction": true,
    "entityResearch": false,
    "steeringTestReport": false
  },
  "steering": {
    "disable": [],
    "rules": []
  }
}
